She's Out of My League,"'Comedy,Romance'",'Jim Field Smith',"'Jay Baruchel, Alice Eve, T.J. Miller, Mike Vogel'",2010,104,31.58
The Other Woman,"'Comedy,Romance'",'Nick Cassavetes',"'Cameron Diaz, Leslie Mann, Kate Upton, Nikolaj Coster-Waldau'",2014,109,83.91
The Ugly Truth,"'Comedy,Romance'",'Robert Luketic',"'Katherine Heigl, Gerard Butler, Bree Turner, Eric Winter'",2009,96,88.92
This Is 40,"'Comedy,Romance'",'Judd Apatow',"'Paul Rudd, Leslie Mann, Maude Apatow, Iris Apatow'",2012,134,67.52
To Rome with Love,"'Comedy,Romance'",'Woody Allen',"'Woody Allen, Penelope Cruz, Jesse Eisenberg, Ellen Page'",2012,112,16.68
Absolutely Anything,"'Comedy,Sci-Fi'",'Terry Jones',"'Simon Pegg, Kate Beckinsale, Sanjeev Bhaskar, Rob Riggle'",2015,85,
Bad Moms,'Comedy','Jon Lucas',"'Mila Kunis, Kathryn Hahn, Kristen Bell,Christina Applegate'",2016,100,113.08
Couples Retreat,'Comedy','Peter Billingsley',"'Vince Vaughn, Malin Akerman, Jon Favreau, Jason Bateman'",2009,113,109.18
Disaster Movie,'Comedy','Jason Friedberg',"'Carmen Electra, Vanessa Lachey,Nicole Parker, Matt Lanter'",2008,87,14.17
Grown Ups,'Comedy','Dennis Dugan',"'Adam Sandler, Salma Hayek, Kevin James, Chris Rock'",2010,102,162
Neighbors,'Comedy','Nicholas Stoller',"'Seth Rogen, Rose Byrne, Zac Efron, Lisa Kudrow'",2014,97,150.06
Office Christmas Party,'Comedy','Josh Gordon',"'Jason Bateman, Olivia Munn, T.J. Miller,Jennifer Aniston'",2016,105,54.73
Sisters,'Comedy','Jason Moore',"'Amy Poehler, Tina Fey, Maya Rudolph, Ike Barinholtz'",2015,118,87.03
Step Brothers,'Comedy','Adam McKay',"'Will Ferrell, John C. Reilly, Mary Steenburgen,Richard Jenkins'",2008,98,100.47
Superbad,'Comedy','Greg Mottola',"'Michael Cera, Jonah Hill, Christopher Mintz-Plasse, Bill Hader'",2007,113,121.46
The Boss,'Comedy','Ben Falcone',"'Melissa McCarthy, Kristen Bell, Peter Dinklage, Ella Anderson'",2016,99,63.03
The Comedian,'Comedy','Taylor Hackford',"'Robert De Niro, Leslie Mann, Danny DeVito, Edie Falco'",2016,120,1.66
The Dictator,'Comedy','Larry Charles',"'Sacha Baron Cohen, Anna Faris, John C. Reilly, Ben Kingsley'",2012,83,59.62
The Hangover,'Comedy','Todd Phillips',"'Zach Galifianakis, Bradley Cooper, Justin Bartha, Ed Helms'",2009,100,277.31
The Internship,'Comedy','Shawn Levy',"'Vince Vaughn, Owen Wilson, Rose Byrne, Aasif Mandvi'",2013,119,44.67
The Interview,'Comedy','Evan Goldberg',"'James Franco, Seth Rogen, Randall Park, Lizzy Caplan'",2014,112,6.11
Why Him?,'Comedy','John Hamburg',"'Zoey Deutch, James Franco, Tangie Ambrose,Cedric the Entertainer'",2016,111,60.31
Perfume: The Story of a Murderer,"'Crime,Drama,Fantasy'",'Tom Tykwer',"'Ben Whishaw, Dustin Hoffman, Alan Rickman,Francesc Albiol'",2006,147,2.21
Spotlight,"'Crime,Drama,History'",'Tom McCarthy',"'Mark Ruffalo, Michael Keaton, Rachel McAdams, Liev Schreiber'",2015,128,44.99
Zodiac,"'Crime,Drama,History'",'David Fincher',"'Jake Gyllenhaal, Robert Downey Jr., Mark Ruffalo,Anthony Edwards'",2007,157,33.05
Hounds of Love,"'Crime,Drama,Horror'",'Ben Young',"'Emma Booth, Ashleigh Cummings, Stephen Curry,Susie Porter'",2016,108,
The Girl Next Door,"'Crime,Drama,Horror'",'Gregory Wilson',"'William Atherton, Blythe Auffarth, Blanche Baker,Kevin Chamberlin'",2007,91,
Step Up,"'Crime,Drama,Music'",'Anne Fletcher',"'Channing Tatum, Jenna Dewan Tatum, Damaine Radcliff, De'Shawn Washington'",2006,104,65.27
A Walk Among the Tombstones,"'Crime,Drama,Mystery'",'Scott Frank',"'Liam Neeson, Dan Stevens, David Harbour, Boyd Holbrook'",2014,114,25.98
All Good Things,"'Crime,Drama,Mystery'",'Andrew Jarecki',"'Ryan Gosling, Kirsten Dunst, Frank Langella, Lily Rabe'",2010,101,0.58
Eastern Promises,"'Crime,Drama,Mystery'",'David Cronenberg',"'Naomi Watts, Viggo Mortensen, Armin Mueller-Stahl, Josef Altin'",2007,100,17.11
Exposed,"'Crime,Drama,Mystery'",'Gee Malik Linton',"'Ana de Armas, Keanu Reeves, Christopher McDonald, Mira Sorvino'",2016,102,
Fracture,"'Crime,Drama,Mystery'",'Gregory Hoblit',"'Anthony Hopkins, Ryan Gosling, David Strathairn,Rosamund Pike'",2007,113,39
Gone Baby Gone,"'Crime,Drama,Mystery'",'Ben Affleck',"'Morgan Freeman, Ed Harris, Casey Affleck, Michelle Monaghan'",2007,114,20.3
Gone Girl,"'Crime,Drama,Mystery'",'David Fincher',"'Ben Affleck, Rosamund Pike, Neil Patrick Harris,Tyler Perry'",2014,149,167.74
Inside Man,"'Crime,Drama,Mystery'",'Spike Lee',"'Denzel Washington, Clive Owen, Jodie Foster,Christopher Plummer'",2006,129,88.5
Lucky Number Slevin,"'Crime,Drama,Mystery'",'Paul McGuigan',"'Josh Hartnett, Ben Kingsley, Morgan Freeman, Lucy Liu'",2006,110,22.49
Prisoners,"'Crime,Drama,Mystery'",'Denis Villeneuve',"'Hugh Jackman, Jake Gyllenhaal, Viola Davis,Melissa Leo'",2013,153,60.96
Solace,"'Crime,Drama,Mystery'",'Afonso Poyart',"'Anthony Hopkins, Jeffrey Dean Morgan, Abbie Cornish, Colin Farrell'",2015,101,
The Drop,"'Crime,Drama,Mystery'",'Michaël R. Roskam',"'Tom Hardy, Noomi Rapace, James Gandolfini,Matthias Schoenaerts'",2014,106,10.72
The Girl on the Train,"'Crime,Drama,Mystery'",'Tate Taylor',"'Emily Blunt, Haley Bennett, Rebecca Ferguson, Justin Theroux'",2016,112,75.31
The Girl with the Dragon Tattoo,"'Crime,Drama,Mystery'",'David Fincher',"'Daniel Craig, Rooney Mara, Christopher Plummer,Stellan Skarsgård'",2011,158,102.52
The Hateful Eight,"'Crime,Drama,Mystery'",'Quentin Tarantino',"'Samuel L. Jackson, Kurt Russell, Jennifer Jason Leigh, Walton Goggins'",2015,187,54.12
A Kind of Murder,"'Crime,Drama,Thriller'",'Andy Goddard',"'Patrick Wilson, Jessica Biel, Haley Bennett, Vincent Kartheiser'",2016,95,0
Child 44,"'Crime,Drama,Thriller'",'Daniel Espinosa',"'Tom Hardy, Gary Oldman, Noomi Rapace, Joel Kinnaman'",2015,137,1.21
End of Watch,"'Crime,Drama,Thriller'",'David Ayer',"'Jake Gyllenhaal, Michael Peña, Anna Kendrick, America Ferrera'",2012,109,40.98
Hacker,"'Crime,Drama,Thriller'",'Akan Satayev',"'Callan McAuliffe, Lorraine Nicholson, Daniel Eric Gold, Clifton Collins Jr.'",2016,95,
Hell or High Water,"'Crime,Drama,Thriller'",'David Mackenzie',"'Chris Pine, Ben Foster, Jeff Bridges, Gil Birmingham'",2016,102,26.86
Law Abiding Citizen,"'Crime,Drama,Thriller'",'F. Gary Gray',"'Gerard Butler, Jamie Foxx, Leslie Bibb, Colm Meaney'",2009,109,73.34
Mr. Brooks,"'Crime,Drama,Thriller'",'Bruce A. Evans',"'Kevin Costner, Demi Moore, William Hurt, Dane Cook'",2007,120,28.48
Nightcrawler,"'Crime,Drama,Thriller'",'Dan Gilroy',"'Jake Gyllenhaal, Rene Russo, Bill Paxton, Riz Ahmed'",2014,118,32.28
No Country for Old Men,"'Crime,Drama,Thriller'",'Ethan Coen',"'Tommy Lee Jones, Javier Bardem, Josh Brolin, Woody Harrelson'",2007,122,74.27
Savages,"'Crime,Drama,Thriller'",'Oliver Stone',"'Aaron Taylor-Johnson, Taylor Kitsch, Blake Lively,Benicio Del Toro'",2012,131,47.31
The Counselor,"'Crime,Drama,Thriller'",'Ridley Scott',"'Michael Fassbender, Penelope Cruz, Cameron Diaz,Javier Bardem'",2013,117,16.97
The Departed,"'Crime,Drama,Thriller'",'Martin Scorsese',"'Leonardo DiCaprio, Matt Damon, Jack Nicholson, Mark Wahlberg'",2006,151,132.37
The Gambler,"'Crime,Drama,Thriller'",'Rupert Wyatt',"'Mark Wahlberg, Jessica Lange, John Goodman, Brie Larson'",2014,111,33.63
The Place Beyond the Pines,"'Crime,Drama,Thriller'",'Derek Cianfrance',"'Ryan Gosling, Bradley Cooper, Eva Mendes,Craig Van Hook'",2012,140,21.38
The Town,"'Crime,Drama,Thriller'",'Ben Affleck',"'Ben Affleck, Rebecca Hall, Jon Hamm, Jeremy Renner'",2010,125,92.17
True Crimes,"'Crime,Drama,Thriller'",'Alexandros Avranas',"'Jim Carrey, Charlotte Gainsbourg, Marton Csokas, Kati Outinen'",2016,92,
Trust,"'Crime,Drama,Thriller'",'David Schwimmer',"'Clive Owen, Catherine Keener, Liana Liberato,Jason Clarke'",2010,106,0.06
American Hustle,"'Crime,Drama'",'David O. Russell',"'Christian Bale, Amy Adams, Bradley Cooper,Jennifer Lawrence'",2013,138,150.12
American Pastoral,"'Crime,Drama'",'Ewan McGregor',"'Ewan McGregor, Jennifer Connelly, Dakota Fanning, Peter Riegert'",2016,108,
Drive,"'Crime,Drama'",'Nicolas Winding Refn',"'Ryan Gosling, Carey Mulligan, Bryan Cranston, Albert Brooks'",2011,100,35.05
Lawless,"'Crime,Drama'",'John Hillcoat',"'Tom Hardy, Shia LaBeouf, Guy Pearce, Jason Clarke'",2012,116,37.4
The Judge,"'Crime,Drama'",'David Dobkin',"'Robert Downey Jr., Robert Duvall, Vera Farmiga, Billy Bob Thornton'",2014,141,47.11
Don't Breathe,"'Crime,Horror,Thriller'",'Fede Alvarez',"'Stephen Lang, Jane Levy, Dylan Minnette, Daniel Zovatto'",2016,88,89.21
Green Room,"'Crime,Horror,Thriller'",'Jeremy Saulnier',"'Anton Yelchin, Imogen Poots, Alia Shawkat,Patrick Stewart'",2015,95,3.22
The Neighbor,"'Crime,Horror,Thriller'",'Marcus Dunstan',"'Josh Stewart, Bill Engvall, Alex Essoe, Ronnie Gene Blevins'",2016,87,
Now You See Me,"'Crime,Mystery,Thriller'",'Louis Leterrier',"'Jesse Eisenberg, Common, Mark Ruffalo, Woody Harrelson'",2013,115,117.7
Ocean's Thirteen,"'Crime,Thriller'",'Steven Soderbergh',"'George Clooney, Brad Pitt, Matt Damon,Michael Mantell'",2007,122,117.14
Cinderella,"'Drama,Family,Fantasy'",'Kenneth Branagh',"'Lily James, Cate Blanchett, Richard Madden,Helena Bonham Carter'",2015,105,201.15
Before I Wake,"'Drama,Fantasy,Horror'",'Mike Flanagan',"'Kate Bosworth, Thomas Jane, Jacob Tremblay,Annabeth Gish'",2016,97,
Crimson Peak,"'Drama,Fantasy,Horror'",'Guillermo del Toro',"'Mia Wasikowska, Jessica Chastain, Tom Hiddleston, Charlie Hunnam'",2015,119,31.06
Goksung,"'Drama,Fantasy,Horror'",'Hong-jin Na',"'Jun Kunimura, Jung-min Hwang, Do-won Kwak, Woo-hee Chun'",2016,156,0.79
Horns,"'Drama,Fantasy,Horror'",'Alexandre Aja',"'Daniel Radcliffe, Juno Temple, Max Minghella, Joe Anderson'",2013,120,0.16
Lady in the Water,"'Drama,Fantasy,Mystery'",'M. Night Shyamalan',"'Paul Giamatti, Bryce Dallas Howard, Jeffrey Wright, Bob Balaban'",2006,110,42.27
The Curious Case of Benjamin Button,"'Drama,Fantasy,Romance'",'David Fincher',"'Brad Pitt, Cate Blanchett, Tilda Swinton, Julia Ormond'",2008,166,127.49
Twilight,"'Drama,Fantasy,Romance'",'Catherine Hardwicke',"'Kristen Stewart, Robert Pattinson, Billy Burke,Sarah Clarke'",2008,122,191.45
The Lovely Bones,"'Drama,Fantasy,Thriller'",'Peter Jackson',"'Rachel Weisz, Mark Wahlberg, Saoirse Ronan, Susan Sarandon'",2009,135,43.98
Pan's Labyrinth,"'Drama,Fantasy,War'",'Guillermo del Toro',"'Ivana Baquero, Ariadna Gil, Sergi López,Maribel Verdú'",,118,37.62
The Tree of Life,"'Drama,Fantasy'",'Terrence Malick',"'Brad Pitt, Sean Penn, Jessica Chastain, Hunter McCracken'",2011,139,13.3
Bridge of Spies,"'Drama,History,Thriller'",'Steven Spielberg',"'Tom Hanks, Mark Rylance, Alan Alda, Amy Ryan'",2015,142,72.31
Patriots Day,"'Drama,History,Thriller'",'Peter Berg',"'Mark Wahlberg, Michelle Monaghan, J.K. Simmons, John Goodman'",2016,133,31.86
The Hurt Locker,"'Drama,History,Thriller'",'Kathryn Bigelow',"'Jeremy Renner, Anthony Mackie, Brian Geraghty,Guy Pearce'",2008,131,15.7
Zero Dark Thirty,"'Drama,History,Thriller'",'Kathryn Bigelow',"'Jessica Chastain, Joel Edgerton, Chris Pratt, Mark Strong'",2012,157,95.72
There Will Be Blood,"'Drama,History'",'Paul Thomas Anderson',"'Daniel Day-Lewis, Paul Dano, Ciarán Hinds,Martin Stringer'",2007,158,40.22
Sweeney Todd: The Demon Barber of Fleet Street,"'Drama,Horror,Musical'",'Tim Burton',"'Johnny Depp, Helena Bonham Carter, Alan Rickman,Timothy Spall'",2007,116,52.88
10 Cloverfield Lane,"'Drama,Horror,Mystery'",'Dan Trachtenberg',"'John Goodman, Mary Elizabeth Winstead, John Gallagher Jr., Douglas M. Griffin'",2016,104,71.9
Let Me In,"'Drama,Horror,Mystery'",'Matt Reeves',"'Kodi Smit-McPhee, Chloë Grace Moretz, Richard Jenkins, Cara Buono'",2010,116,12.13
28 Weeks Later,"'Drama,Horror,Sci-Fi'",'Juan Carlos Fresnadillo',"'Jeremy Renner, Rose Byrne, Robert Carlyle, Harold Perrineau'",2007,100,28.64
I Am Legend,"'Drama,Horror,Sci-Fi'",'Francis Lawrence',"'Will Smith, Alice Braga, Charlie Tahan, Salli Richardson-Whitfield'",2007,101,256.39
Victor Frankenstein,"'Drama,Horror,Sci-Fi'",'Paul McGuigan',"'Daniel Radcliffe, James McAvoy, Jessica Brown Findlay, Andrew Scott'",2015,110,5.77
The Girl with All the Gifts,"'Drama,Horror,Thriller'",'Colm McCarthy',"'Gemma Arterton, Glenn Close, Dominique Tipper,Paddy Considine'",2016,111,
The Shallows,"'Drama,Horror,Thriller'",'Jaume Collet-Serra',"'Blake Lively, Óscar Jaenada, Angelo Josue Lozano Corzo, Brett Cullen'",2016,86,55.12
Carrie,"'Drama,Horror'",'Kimberly Peirce',"'Chloë Grace Moretz, Julianne Moore, Gabriella Wilde, Portia Doubleday'",2013,100,35.27
The Babadook,"'Drama,Horror'",'Jennifer Kent',"'Essie Davis, Noah Wiseman, Daniel Henshall, Hayley McElhinney'",2014,93,0.92
We Are Your Friends,"'Drama,Music,Romance'",'Max Joseph',"'Zac Efron, Wes Bentley, Emily Ratajkowski, Jonny Weston'",2015,96,3.59
Whiplash,"'Drama,Music'",'Damien Chazelle',"'Miles Teller, J.K. Simmons, Melissa Benoist, Paul Reiser'",2014,107,13.09
Les Miserables,"'Drama,Musical,Romance'",'Tom Hooper',"'Hugh Jackman, Russell Crowe, Anne Hathaway,Amanda Seyfried'",2012,158,148.78
Atonement,"'Drama,Mystery,Romance'",'Joe Wright',"'Keira Knightley, James McAvoy, Brenda Blethyn,Saoirse Ronan'",2007,123,50.92
The Illusionist,"'Drama,Mystery,Romance'",'Neil Burger',"'Edward Norton, Jessica Biel, Paul Giamatti, Rufus Sewell'",2006,110,39.83
Transcendence,"'Drama,Mystery,Romance'",'Wally Pfister',"'Johnny Depp, Rebecca Hall, Morgan Freeman, Cillian Murphy'",2014,119,23.01
Arrival,"'Drama,Mystery,Sci-Fi'",'Denis Villeneuve',"'Amy Adams, Jeremy Renner, Forest Whitaker,Michael Stuhlbarg'",2016,116,100.5
Ex Machina,"'Drama,Mystery,Sci-Fi'",'Alex Garland',"'Alicia Vikander, Domhnall Gleeson, Oscar Isaac,Sonoya Mizuno'",2014,108,25.44
Midnight Special,"'Drama,Mystery,Sci-Fi'",'Jeff Nichols',"'Michael Shannon, Joel Edgerton, Kirsten Dunst, Adam Driver'",2016,112,3.71
Moon,"'Drama,Mystery,Sci-Fi'",'Duncan Jones',"'Sam Rockwell, Kevin Spacey, Dominique McElligott,Rosie Shaw'",2009,97,5.01
Predestination,"'Drama,Mystery,Sci-Fi'",'Michael Spierig',"'Ethan Hawke, Sarah Snook, Noah Taylor, Madeleine West'",2014,97,
The Prestige,"'Drama,Mystery,Sci-Fi'",'Christopher Nolan',"'Christian Bale, Hugh Jackman, Scarlett Johansson, Michael Caine'",2006,130,53.08
Disturbia,"'Drama,Mystery,Thriller'",'D.J. Caruso',"'Shia LaBeouf, David Morse, Carrie-Anne Moss, Sarah Roemer'",2007,105,80.05
Personal Shopper,"'Drama,Mystery,Thriller'",'Olivier Assayas',"'Kristen Stewart, Lars Eidinger, Sigrid Bouaziz,Anders Danielsen Lie'",2016,105,1.29
The Invitation,"'Drama,Mystery,Thriller'",'Karyn Kusama',"'Logan Marshall-Green, Emayatzy Corinealdi, Michiel Huisman, Tammy Blanchard'",2015,100,0.23
Tinker Tailor Soldier Spy,"'Drama,Mystery,Thriller'",'Tomas Alfredson',"'Gary Oldman, Colin Firth, Tom Hardy, Mark Strong'",2011,122,24.1
We Need to Talk About Kevin,"'Drama,Mystery,Thriller'",'Lynne Ramsay',"'Tilda Swinton, John C. Reilly, Ezra Miller, Jasper Newell'",2011,112,1.74
Equals,"'Drama,Romance,Sci-Fi'",'Drake Doremus',"'Nicholas Hoult, Kristen Stewart, Vernetta Lopez,Scott Lawrence'",2015,101,0.03
Her,"'Drama,Romance,Sci-Fi'",'Spike Jonze',"'Joaquin Phoenix, Amy Adams, Scarlett Johansson,Rooney Mara'",2013,126,25.56
Safe Haven,"'Drama,Romance,Thriller'",'Lasse Hallström',"'Julianne Hough, Josh Duhamel, Cobie Smulders,David Lyons'",2013,115,71.35
Adoration,"'Drama,Romance'",'Anne Fontaine',"'Naomi Watts, Robin Wright, Xavier Samuel, James Frecheville'",2013,112,0.32
Blue Valentine,"'Drama,Romance'",'Derek Cianfrance',"'Ryan Gosling, Michelle Williams, John Doman,Faith Wladyka'",2010,112,9.7
Brooklyn,"'Drama,Romance'",'John Crowley',"'Saoirse Ronan, Emory Cohen, Domhnall Gleeson,Jim Broadbent'",2015,117,38.32
Jane Eyre,"'Drama,Romance'",'Cary Joji Fukunaga',"'Mia Wasikowska, Michael Fassbender, Jamie Bell, Su Elliot'",2011,120,11.23
One Day,"'Drama,Romance'",'Lone Scherfig',"'Anne Hathaway, Jim Sturgess, Patricia Clarkson,Tom Mison'",2011,107,13.77
P.S. I Love You,"'Drama,Romance'",'Richard LaGravenese',"'Hilary Swank, Gerard Butler, Harry Connick Jr., Lisa Kudrow'",2007,126,53.68
Remember Me,"'Drama,Romance'",'Allen Coulter',"'Robert Pattinson, Emilie de Ravin, Caitlyn Rund,Moises Acevedo'",2010,113,19.06
Revolutionary Road,"'Drama,Romance'",'Sam Mendes',"'Leonardo DiCaprio, Kate Winslet, Christopher Fitzgerald, Jonathan Roumie'",,119,22.88
Seven Pounds,"'Drama,Romance'",'Gabriele Muccino',"'Will Smith, Rosario Dawson, Woody Harrelson,Michael Ealy'",2008,123,69.95
The Best of Me,"'Drama,Romance'",'Michael Hoffman',"'James Marsden, Michelle Monaghan, Luke Bracey,Liana Liberato'",2014,118,26.76
The Fault in Our Stars,"'Drama,Romance'",'Josh Boone',"'Shailene Woodley, Ansel Elgort, Nat Wolff, Laura Dern'",2014,126,124.87
The Light Between Oceans,"'Drama,Romance'",'Derek Cianfrance',"'Michael Fassbender, Alicia Vikander, Rachel Weisz, Florence Clery'",2016,133,12.53
The Lucky One,"'Drama,Romance'",'Scott Hicks',"'Zac Efron, Taylor Schilling, Blythe Danner, Riley Thomas Stewart'",2012,101,60.44
The Perks of Being a Wallflower,"'Drama,Romance'",'Stephen Chbosky',"'Logan Lerman, Emma Watson, Ezra Miller, Paul Rudd'",2012,102,17.74
Children of Men,"'Drama,Sci-Fi,Thriller'",'Alfonso Cuarón',"'Julianne Moore, Clive Owen, Chiwetel Ejiofor,Michael Caine'",2006,109,35.29
Gravity,"'Drama,Sci-Fi,Thriller'",'Alfonso Cuarón',"'Sandra Bullock, George Clooney, Ed Harris, Orto Ignatiussen'",2013,91,274.08
Into the Forest,"'Drama,Sci-Fi,Thriller'",'Patricia Rozema',"'Ellen Page, Evan Rachel Wood, Max Minghella,Callum Keith Rennie'",2015,101,0.01
Cloud Atlas,"'Drama,Sci-Fi'",'Tom Tykwer',"'Tom Hanks, Halle Berry, Hugh Grant, Hugo Weaving'",2012,172,27.1
The Fountain,"'Drama,Sci-Fi'",'Darren Aronofsky',"'Hugh Jackman, Rachel Weisz, Sean Patrick Thomas, Ellen Burstyn'",2006,96,10.14
Creed,"'Drama,Sport'",'Ryan Coogler',"'Michael B. Jordan, Sylvester Stallone, Tessa Thompson, Phylicia Rashad'",2015,133,109.71
Rocky Balboa,"'Drama,Sport'",'Sylvester Stallone',"'Sylvester Stallone, Antonio Tarver, Milo Ventimiglia, Burt Young'",2006,102,70.27
Southpaw,"'Drama,Sport'",'Antoine Fuqua',"'Jake Gyllenhaal, Rachel McAdams, Oona Laurence,Forest Whitaker'",2015,124,52.42
Eye in the Sky,"'Drama,Thriller,War'",'Gavin Hood',"'Helen Mirren, Aaron Paul, Alan Rickman, Barkhad Abdi'",2015,102,18.7
Contagion,"'Drama,Thriller'",'Steven Soderbergh',"'Matt Damon, Kate Winslet, Jude Law, Gwyneth Paltrow'",2011,106,75.64
Flight,"'Drama,Thriller'",'Robert Zemeckis',"'Denzel Washington, Nadine Velazquez, Don Cheadle, John Goodman'",2012,138,93.75
Man Down,"'Drama,Thriller'",'Dito Montiel',"'Shia LaBeouf, Jai Courtney, Gary Oldman, Kate Mara'",2015,90,
Nocturnal Animals,"'Drama,Thriller'",'Tom Ford',"'Amy Adams, Jake Gyllenhaal, Michael Shannon, Aaron Taylor-Johnson'",2016,116,10.64
The imposible,"'Drama,Thriller'",'J.A. Bayona',"'Naomi Watts, Ewan McGregor, Tom Holland, Oaklee Pendergast'",2012,114,19
The Lives of Others,"'Drama,Thriller'",'Florian Henckel von Donnersmarck',"'Ulrich Mühe, Martina Gedeck,Sebastian Koch, Ulrich Tukur'",2006,137,11.28
Macbeth,"'Drama,War'",'Justin Kurzel',"'Michael Fassbender, Marion Cotillard, Jack Madigan,Frank Madigan'",2015,113,
The Boy in the Striped Pyjamas,"'Drama,War'",'Mark Herman',"'Asa Butterfield, David Thewlis, Rupert Friend, Zac Mattoon O'Brien'",2008,94,9.03
Django Unchained,"'Drama,Western'",'Quentin Tarantino',"'Jamie Foxx, Christoph Waltz, Leonardo DiCaprio,Kerry Washington'",2012,165,162.8
Babel,'Drama','Alejandro González Iñárritu',"'Brad Pitt, Cate Blanchett, Gael García Bernal, Mohamed Akhzam'",2006,143,34.3
Below Her Mouth,'Drama','April Mullen',"'Erika Linder, Natalie Krill, Sebastian Pigott, Mayko Nguyen'",2016,94,
Boyhood,'Drama','Richard Linklater',"'Ellar Coltrane, Patricia Arquette, Ethan Hawke,Elijah Smith'",2014,165,25.36
Gran Torino,'Drama','Clint Eastwood',"'Clint Eastwood, Bee Vang, Christopher Carley,Ahney Her'",2008,116,148.09
Joy,'Drama','David O. Russell',"'Jennifer Lawrence, Robert De Niro, Bradley Cooper, Edgar Ramírez'",2015,124,56.44
Lady Macbeth,'Drama','William Oldroyd',"'Florence Pugh, Christopher Fairbank, Cosmo Jarvis, Naomi Ackie'",2016,89,
Manchester by the Sea,'Drama','Kenneth Lonergan',"'Casey Affleck, Michelle Williams, Kyle Chandler,Lucas Hedges'",2016,137,47.7
Moonlight,'Drama','Barry Jenkins',"'Mahershala Ali, Shariff Earp, Duan Sanderson, Alex R. Hibbert'",2016,111,27.85
Paint It Black,'Drama','Amber Tamblyn',"'Alia Shawkat, Nancy Kwan, Annabelle Attanasio,Alfred Molina'",2016,96,
Precious,'Drama','Lee Daniels',"'Gabourey Sidibe, Mo'Nique, Paula Patton, Mariah Carey'",2009,110,47.54
Room,'Drama','Lenny Abrahamson',"'Brie Larson, Jacob Tremblay, Sean Bridgers,Wendy Crewson'",2015,118,14.68
Shame,'Drama','Steve McQueen',"'Michael Fassbender, Carey Mulligan, James Badge Dale, Lucy Walters'",2011,101,4
Slumdog Millionaire,'Drama','Danny Boyle',"'Dev Patel, Freida Pinto, Saurabh Shukla, Anil Kapoor'",2008,120,141.32
The Daughter,'Drama','Simon Stone',"'Geoffrey Rush, Nicholas Hope, Sam Neill, Ewen Leslie'",2015,96,0.03
The Help,'Drama','Tate Taylor',"'Emma Stone, Viola Davis, Octavia Spencer, Bryce Dallas Howard'",2011,146,169.71
The Sea of Trees,'Drama','Gus Van Sant',"'Matthew McConaughey, Naomi Watts, Ken Watanabe,Ryoko Seta'",2015,110,0.02
Winter's Bone,'Drama','Debra Granik',"'Jennifer Lawrence, John Hawkes, Garret Dillahunt,Isaiah Stone'",2010,100,
1408,"'Fantasy,Horror'",'Mikael Håfström',"'John Cusack, Samuel L. Jackson, Mary McCormack, Paul Birchard'",2007,104,71.98
Evil Dead,"'Fantasy,Horror'",'Fede Alvarez',"'Jane Levy, Shiloh Fernandez, Jessica Lucas, Lou Taylor Pucci'",2013,91,54.24
Annabelle,"'Horror,Mystery,Thriller'",'John R. Leonetti',"'Ward Horton, Annabelle Wallis, Alfre Woodard,Tony Amendola'",2014,99,84.26
Insidious,"'Horror,Mystery,Thriller'",'James Wan',"'Patrick Wilson, Rose Byrne, Ty Simpkins, Lin Shaye'",2010,103,53.99
Orphan,"'Horror,Mystery,Thriller'",'Jaume Collet-Serra',"'Vera Farmiga, Peter Sarsgaard, Isabelle Fuhrman, CCH Pounder'",2009,123,41.57
The Autopsy of Jane Doe,"'Horror,Mystery,Thriller'",'Andre Øvredal',"'Brian Cox, Emile Hirsch, Ophelia Lovibond, Michael McElhatton'",2016,86,
The Conjuring,"'Horror,Mystery,Thriller'",'James Wan',"'Patrick Wilson, Vera Farmiga, Ron Livingston, Lili Taylor'",2013,112,137.39
The Strangers,"'Horror,Mystery,Thriller'",'Bryan Bertino',"'Scott Speedman, Liv Tyler, Gemma Ward, Alex Fisher'",2008,86,52.53
Sinister,"'Horror,Mystery'",'Scott Derrickson',"'Ethan Hawke, Juliet Rylance, James Ransone,Fred Dalton Thompson'",2012,110,48.06
Morgan,"'Horror,Sci-Fi,Thriller'",'Luke Scott',"'Kate Mara, Anya Taylor-Joy, Rose Leslie, Michael Yare'",2016,92,3.91
Rupture,"'Horror,Sci-Fi,Thriller'",'Steven Shainberg',"'Noomi Rapace, Michael Chiklis, Kerry Bishe,Peter Stormare'",2016,102,
The Purge,"'Horror,Sci-Fi,Thriller'",'James DeMonaco',"'Ethan Hawke, Lena Headey, Max Burkholder,Adelaide Kane'",2013,85,64.42
31,"'Horror,Thriller'",'Rob Zombie',"'Malcolm McDowell, Richard Brake, Jeff Daniel Phillips,Sheri Moon Zombie'",2016,102,0.78
Blair Witch,"'Horror,Thriller'",'Adam Wingard',"'James Allen McCune, Callie Hernandez, Corbin Reid, Brandon Scott'",2016,89,20.75
Friend Request,"'Horror,Thriller'",'Simon Verhoeven',"'Alycia Debnam-Carey, William Moseley, Connor Paolo, Brit Morgan'",2016,92,64.03
Hush,"'Horror,Thriller'",'Mike Flanagan',"'John Gallagher Jr., Kate Siegel, Michael Trucco,Samantha Sloyan'",2016,81,
Mama,"'Horror,Thriller'",'Andres Muschietti',"'Jessica Chastain, Nikolaj Coster-Waldau, Megan Charpentier, Isabelle Nelisse'",2013,100,71.59
Pet,"'Horror,Thriller'",'Carles Torrens',"'Dominic Monaghan, Ksenia Solo, Jennette McCurdy,Da'Vone McDonald'",2016,94,
Split,"'Horror,Thriller'",'M. Night Shyamalan',"'James McAvoy, Anya Taylor-Joy, Haley Lu Richardson, Jessica Sula'",2016,117,138.12
The Neon Demon,"'Horror,Thriller'",'Nicolas Winding Refn',"'Elle Fanning, Christina Hendricks, Keanu Reeves, Karl Glusman'",2016,118,1.33
Friday the 13th,'Horror','Marcus Nispel',"'Jared Padalecki, Amanda Righetti, Derek Mears,Danielle Panabaker'",2009,97,65
Lights Out,'Horror','David F. Sandberg',"'Teresa Palmer, Gabriel Bateman, Maria Bello,Billy Burke'",2016,81,67.24
The Cabin in the Woods,'Horror','Drew Goddard',"'Kristen Connolly, Chris Hemsworth, Anna Hutchison,Fran Kranz'",2012,95,42.04
The Hills Have Eyes,'Horror','Alexandre Aja',"'Ted Levine, Kathleen Quinlan, Dan Byrd, Emilie de Ravin'",2006,107,41.78
The Mist,'Horror','Frank Darabont',"'Thomas Jane, Marcia Gay Harden, Laurie Holden,Andre Braugher'",2007,126,25.59
Source Code,"'Mystery,Romance,Sci-Fi'",'Duncan Jones',"'Jake Gyllenhaal, Michelle Monaghan, Vera Farmiga,Jeffrey Wright'",2011,93,54.7
The Loft,"'Mystery,Romance,Thriller'",'Erik Van Looy',"'Karl Urban, James Marsden, Wentworth Miller, Eric Stonestreet'",2014,108,5.98
Limitless,"'Mystery,Sci-Fi,Thriller'",'Neil Burger',"'Bradley Cooper, Anna Friel, Abbie Cornish, Robert De Niro'",2011,105,79.24
Super 8,"'Mystery,Sci-Fi,Thriller'",'J.J. Abrams',"'Elle Fanning, AJ Michalka, Kyle Chandler, Joel Courtney'",2011,112,126.98
Enemy,"'Mystery,Thriller'",'Denis Villeneuve',"'Jake Gyllenhaal, Melanie Laurent, Sarah Gadon,Isabella Rossellini'",2013,91,1.01
Shutter Island,"'Mystery,Thriller'",'Martin Scorsese',"'Leonardo DiCaprio, Emily Mortimer, Mark Ruffalo,Ben Kingsley'",2010,138,127.97
The Da Vinci Code,"'Mystery,Thriller'",'Ron Howard',"'Tom Hanks, Audrey Tautou, Jean Reno, Ian McKellen'",2006,149,217.54
The Ghost Writer,"'Mystery,Thriller'",'Roman Polanski',"'Ewan McGregor, Pierce Brosnan, Olivia Williams,Jon Bernthal'",2010,128,15.52
The Gift,"'Mystery,Thriller'",'Joel Edgerton',"'Jason Bateman, Rebecca Hall, Joel Edgerton, Allison Tolman'",2015,108,43.77
The Adjustment Bureau,"'Romance,Sci-Fi,Thriller'",'George Nolfi',"'Matt Damon, Emily Blunt, Lisa Thoreson, Florence Kastriner'",2011,106,62.45