A Million Ways to Die in the West,"'Comedy,Romance,Western'",'Seth MacFarlane',"'Seth MacFarlane, Charlize Theron, Liam Neeson,Amanda Seyfried'",2014,116,42.62
Bride Wars,"'Comedy,Romance'",'Gary Winick',"'Kate Hudson, Anne Hathaway, Candice Bergen, Bryan Greenberg'",2009,89,58.72
Bridesmaids,"'Comedy,Romance'",'Paul Feig',"'Kristen Wiig, Maya Rudolph, Rose Byrne, Terry Crews'",2011,125,169.08
Friends with Benefits,"'Comedy,Romance'",'Will Gluck',"'Mila Kunis, Justin Timberlake, Patricia Clarkson, Jenna Elfman'",2011,109,55.8
How to Be Single,"'Comedy,Romance'",'Christian Ditter',"'Dakota Johnson, Rebel Wilson, Leslie Mann, Alison Brie'",2016,110,46.81
Just Go with It,"'Comedy,Romance'",'Dennis Dugan',"'Adam Sandler, Jennifer Aniston, Brooklyn Decker,Nicole Kidman'",2011,117,103.03
Knocked Up,"'Comedy,Romance'",'Judd Apatow',"'Seth Rogen, Katherine Heigl, Paul Rudd, Leslie Mann'",2007,129,148.73
Movie 43,"'Comedy,Romance'",'Elizabeth Banks',"'Emma Stone, Stephen Merchant, Richard Gere, Liev Schreiber'",2013,94,8.83
No Strings Attached,"'Comedy,Romance'",'Ivan Reitman',"'Natalie Portman, Ashton Kutcher, Kevin Kline, Cary Elwes'",2011,108,70.63